Course Code,Course Name,Course Summary
COMP6451,Cryptocurrency and Distributed Ledger Technologies,"Cryptocurrency and Distributed Ledger Technologies are a currently emerging area of technology that draws on multiple areas of computer science to implement systems that provide secure infrastructure for important societal functions, including financial transactions and the management of commercial trust relationships.This course aims to develop an understanding of the requirements for electronic payment systems and how these requirements are realised using distributed ledger technologies. The technical ideas to be understood include the key cryptographic constructs, economic incentive mechanisms and distributed algorithms underpinning cryptocurrencies such as Bitcoin and Ethereum. The concept of smart contract will be introduced, and the course aims to develop a basic facility with programming smart contracts on one cryptocurrency platform. The course also aims to introduce students to the broader context of the range of alternate designs for distributed ledger technologies, the range of potential applications for these technologies, and the socioeconomic, ethical and legal dimensions of their use."
COMP6452,Software Architecture for Blockchain Applications,"This course addresses the knowledge that is needed in order to build applications based on blockchain technology, by offering an architectural view of software systems that make beneficial use of it. It provides guidance on assessing the suitability of blockchain, on the roles blockchain can play in an architecture, on designing blockchain applications, and on assessing different architecture designs and tradeoffs. It also serves as a reference on blockchain design patterns and design analysis, and refers to practical examples of blockchainbased applications.The course covers the following:a general introduction to the topic and to existing blockchain platforms including Bitcoin, Ethereum, and Hyperledger Fabric, and offers examples of blockchainbased applications;, the functional aspects of software architecture are covered, describing the main roles blockchain can play in an architecture, as well as its potential suitability and design process;, nonfunctional aspects of blockchain applications, which are often crosscutting concerns including cost estimation, performance, security;Realworld use cases will be covered, offering additional insights from a practical perspective."
COMP6453,Applied Cryptography,"Cryptography is an indispensable tool for protecting information in computer systems. This course is designed to provide an understanding of Cryptographic algorithms and Cryptanalysis with an aim of using them to protect computer systems, networks, and data protection. The course will emphasise on the foundational aspects of encryption and authentication techniques with an aim to use them correctly and effectively in applications.The technical ideas to be understood include classical algorithms, symmetric key encryption algorithms, public key encryption algorithms, cryptanalysis of ciphers, hash functions, digital signatures, zeroknowledge proofs. Applications like credential management, computing on encrypted data in cloud homomorphic encryption, secure multiparty computation, secure network protocols, blockchains will be explored. Post quantum Cryptography will also be studied."
COMP6713,Natural Language Processing,"Natural language processing NLP is a branch of artificial intelligence that deals with computational approaches used to process text.Human language i.E., natural language is inherently ambiguous. Ambiguity resolution using computational techniques is at the heart of NLP. As a result, the advancements in NLP can be visualized as three generations: rulebased, statistical and neural. The course introduces the three generations of NLP through the philosophy of ambiguity resolution being the core task of NLP. The content covers different NLP subproblems such as POS tagging, sentiment classification, named entity recognition, machine translation and summarisation, and typical approaches in the three generations to tackle these subproblems.With recent advancements in large language models, there has been a renewed interest in NLP from industry and research alike. However, NLP precedes large language models. The exposition of NLP centered around ambiguity resolution helps to develop an understanding of the past and the present of NLP."
COMP6714,Information Retrieval and Web Search,"Information retrieval IR is the process of retrieving relevant information by specifying a query to an IR system. Web search is one form of an IR system that allows users to search information on the Internet based on a search engine. It involves computing a numeric score on how well each result matches the query and ranking the results according to this score.This course aims to introduce the concepts, theories, and algorithmic issues important to Information Retrieval. If time allows, the course will also cover some recent topics and common practices. The course is composed of the following parts:Information Retrieval:olDocument modeling, Inverted index construction and compression, Vector space model and ranking methods, Probabilistic and language models, Evaluation methods, Relevance feedback and query expansion.OlWeb Search:olWeb search engine architecture, Web crawling and indexing, Web structure and usage analytics.OlThe lecture materials will be complemented by a nonprogramming assignment and a programming project."
COMP6721,(In-)Formal Methods: The Lost Art,"InFormal Methodsare practical structuring and design patterns that encourage programming that is easy to understand and to maintain. They are only a part of the large body of good programming practices, distinguished from that larger set because for the methods we consider the computerscience community has determined thesciencebehind the structures: we know why they are effective.Unusually, this course does not take the traditional route of teaching that science first, and then turning it into practical programming toolsofthought. Instead, we teach the mental tools first, try them on examples and only then, once their effectiveness has been demonstrated, will we look behind the scenes to see where they come from.Initially the material will deal with conventional programs, those that must give the right output. This is known asfunctionalcorrectness, and a sorting program is a simple example. Later in the course we will look at additional correctness criteria, such assecurityperform this calculation in a way that keeps part of the answer hidden andrandomisationimplement overtheinternet protocols that depend intrinsically on coinflipping. Those last two topics will draw on uptotheminute research."
COMP6733,Internet of Things Experimental Design Studio,"Internet of Things IoT will play a key role in the next frontier of computing. The new course will provide an experimental approach to cover fundamental design principles behind building IoT applications, with handson experience with a popular endtoend IoT platform.Topics covered will include a selection from: IoT technology and services, IoT system architecture, Low Power communications Bluetooth Low Energy and 6LoWPAN and security issues, sensors and sensor data smoothing and filtering, lightweight insitu machine learning and data fusion, inertial sensing, activity recognition and fitness morning, voicebased stress level sensing, biometric authentication, anonymity, cloud services for IoT. This course assumes familiarity with a high level programming language such as Java and Python AND a low level programming language such as C."
COMP6741,Algorithms for Intractable Problems,"The course focuses on algorithms for solving intractable computational problems, socalled NPhard problems. Ideally, one would want to design algorithms that solve each instance exactly and in polynomial time. But since no polynomial time algorithm is known for any NPhard problem, we will relax these requirements and design algorithms that either do not solve the problem exactly, that only solve a subset of instances, or whose worstcase running time is superpolynomial in the input size or some other parameter of the input.Among algorithms that do not solve the problem exactly, we discuss heuristics and approximation algorithms. Heuristics do not guarantee to compute optimal solutions but tend to work well in practice. Approximation algorithms give additional guarantees of the quality of computed solution as compared to the optimal solution.Among algorithms that only solve a subset of instances, we discuss graph classes where NPhard graph problems often become polynomialtime solvable when the input is restricted to these classes.Among algorithms that do not run in polynomial time, we discuss exponentialtime algorithms and parameterized algorithms. In exponentialtime algorithms we discuss algorithmic techniques to solve NPhard problems provably faster than bruteforce in the worst case. In parameterized algorithms, a parameter k is associated with each instance and the goal is to design algorithms whose worstcase running time is fast whenever k is small. We will also see lower bounds for problems and how to rule out certain running times under various complexity assumptions.In addition to deterministic algorithms, we discuss speedups if we have access to randomised algorithms or quantum algorithms."
COMP6752,Modelling Concurrent Systems,"This course tries to make students familiar with stateoftheart techniques in modelling concurrent systems. This is done by comparing some of the more successful models of concurrency found in the literature. The focus will be on the rationale behind the design decisions underlying those models, viewed from philosophical, mathematical and computational perspectives. The course contains important background knowledge for students aiming at a scientific career in which the design of mathematical models of system behaviour is a component.Topics chosen from: semantic models of concurrent and distributed systems e.G. Process algebra, event structures, Petri nets, Chu spaces, operational and denotational semantics, semantic equivalences and implementation relations, linear versus branching time, interleaving versus partial order semantics, true concurrency, algorithms for equivalence checking and their complexity, modal and temporal logic for concurrent systems."
COMP6771,Advanced C++ Programming,"COMP6771 is an advanced programming course teaching practical aspects of intermediateadvanced C programming. The course focuses on teaching the fundamentals of C, followed by exploring powerful abstractions that C enables. This course focuses on using abstractions as well as building abstractions.COMP6771 is focused on modern, practical programming methods and tools. This course is designed for latter year CSE students with a reasonable degree of programming competencies.The course is heavily supported by Christopher Di Bella , a UNSW CSE graduate who is a wellregarded expert on C. His knowledge and expertise assists in forming and updating the course.Our aim for students who complete this course satisfactorily is that they are highly competent in understanding C and its core features, being able to build complex programs, data structures, and algorithms with C, and being ready to immediately move into the workforce in areas that rely heavily on C.COMP6771 can be a challenging course for students due to the volume of work to complete in a 10 week period."
COMP6841,Extended Security Engineering and Cyber Security,"In this introductory cybersecurity course we look at Security Engineering the engineering principles behind designing, monitoring, and maintaining security in the face of an adversary. We explore selected case studies and examine the practical principles behind effective security. We introduce the fundamental ideas of security and then we look at how these are applied in current cyber security practice. We will pay particular attentionto systems which fail and the importance of thinking like an attacker. This course involves analysis, critical thinking and design. A cunning and devious mind will be an asset. Although our main concern is cybersecurity, the engineering principles we cover apply to security more generally.This course introduces modern cybersecurity design and practice, and is suitable for anyone with a playful analytical mind and a general interest in security. We assume knowledge of coding, ideally in C, and knowledge of low level computing concepts such as memory implementation and function calling. The course provides an introduction to applied cyber security, as well asanalytical skills and taking an engineering approach to security design. Well also bring you up to date with the current main trends in cybersecurity.In this course you will undertake an applied self directed security project.There is an associated Core version of this course COMP6441. CSE students will probably choose to take this Extended course rather than the core course, but are not required to. You can transfer between these two associated courses before the census date if you cant make up your mind in advance which is better for you.This extended course is the core course plus additional applied technical material.After completing COMP6841 you can proceed to the other UNSW Computing Security Courses covering topics in:Digital forensics, Penetration testing, Memory corruption and exploitation, Software assurance, Incident response, Malware analysis and reversing, Cryptanalysis, Professional issues and leadership in security, Web application security, Special projects, MasterclassThe precise topics covered in this course will change from year to year to keep the coverage uptodate and relevant. The field is now too big for us to cover everything in detail in a single course but by the end of this course you will have an overview of the major topics in contemporarysecurity,a good understandingof the current state of the field,andhave begunto think like a security engineer.Our intention is tomake this a highly enjoyable course. The field is quite stimulating as the security mindset you will develop involves understanding know how to break things in creative ways as well as how to create things as is traditional in computing with puzzles, cunning, cloakanddagger antics and a neverending supplyof amusing stories. However it will not be an easy course you are expected to master the underlying theory and to be able to apply it to real world situations. There is a lot to learn and we expect you to work hard and study it in your own time."
COMP6843,Extended Web Application Security and Testing,"Web applications are currently the predominant source of software vulnerabilities exploited in in online attacks. There is a growing need and growing demand for web programmers to be security aware.This course covers the main types of web application vulnerabilities and current best practice professional coding and testing practices to be able to successfully develop secure web applications.The course covers OWASP vulnerabilities cross site scripting browser security model and weaknesses Injection attacks DNS Man in the middle Data leakage Spoofing UI and Social vulnerabilities Assurance and Testing Standards. Course coverage will be constantly updated over time to reflect emerging vulnerabilities and practices.There are numerous formative assessments and activities throughout the course to provide feedback and learning opportunities. These do not directly contribute to your final grade but are expected to be used to provide evidence of your capabilities in your portfolio.A programming background is required. Students also need a keen devious and analytical mind. To get the most from this course students will need to engage in independent study and research and be able to act as independent self directed learners.This is the extended version of COMP6443. This course includes the material of COMP6443 plus penetration testing, and red teaming. Students will work in teams to conduct penetration tests and report on them to real and simulated clients."
COMP6845,Extended Digital Forensics and Incident Response,"The subject of Digital Forensics is a blend of technical expertise, legal procedures for an expert witness, persuasive report writing and your performance in the theatre of court. This course covers both forensic theory professional practice, and looking at the underlying engineering of hiding, finding, interpreting and responding to traces. Students will use of standard forensic tools to extract, carve and analyse data as well as learning the lowlevel technical skills and knowledge underlying them. Students will also be introduced to advanced topics such as Cloud Forensics and latest antiforensics techniques.COMP6445 and COMP6845 run in an overlapping mode. Both share a set of common activities and assessments; however COMP6845 students have additional extension activities and assessments related to digital forensics. These activities offer more advanced and indepth study of the topic.The information below applies to both courses except where otherwise indicated. The main differences between COMP6445 and COMP6845 derive from the motivations behind them, unlike other SECedu courses, the extended course COMP6845 is not only exclusively a more technical deep dive into core COMP6445 concepts but also exposes students to advanced topics in Digital Forensics such as Splunk Logging, iOS and Android Forensics. Hence, COMP6845 includes a deeper dive into more technical aspects of digital forensics. This is achieved through additional weekly workshoplecture during the term.COMP6445 students are welcome to attend the extended lectures.By the end of the course students should be able to write and analyse simple forensic tools as well as being able to use them. The course covers Memory Forensics, Disc Forensics Network, Device Forensics, Stealth Techniques, Antiforensics, Professional Forensic Practice, chain of custody, records etc, Logging, and Mobile Forensics. Students of this course will apply forensic methods in controlled environments and gain an understanding of the technical process of uncovering hidden data and other metadata which may reveal user behaviour. Students will also develop skills in reporting their findings and evaluate the ethical consequences of their findings. Digital Forensics students are invited to participate in a mock courtroom experience involving testimony and crossexamination of digital forensics expert witnesses. We plan to run a mock civil trial of company vs rogue employee with a presiding Judge, and lecturers acting as advocates and students as expert witnesses."
COMP6991,Solving Modern Programming Problems with Rust,"This course aims to provide commentary and critique on the practice of programming, and the tooling used to program primarily programming languages themselves. A variety of programming concepts across many programming languages are examined, including: syntax, typing, polymorphism, documentation, testing, metaprogramming, concurrency, parallelism, safety, and more. The Rust programming language is used as a reference language to teach considerations behind these concepts. As a language commonly cited to be wellconsidered, it serves as a good foundation to help students understand where countless other languages may let them down. Lectures will compare and contrast Rust with other languages, but will also discuss where Rust can similarly let students down.While proficiency in writing Rust programs is an important learning outcome of this course, of greater importance is the ability to write more robust programs in whichever language a student happens to be using at the time.Per the advice of previous students, COMP6991 is adifficultcourse with a considerable workload. Please reach out to us either on the course forum or the course email if youre not sure whether COMP6991 is right for you."
COMP9242,Advanced Operating Systems,"The course provides students with a deep understanding of modern operating system technology, implementation techniques and research issues.This course builds upon the basic operating systems course COMP3231920138919283, which provides an understanding of the underlying operating systems which students have implicitly relied upon in developing applications in foundational courses within Computer Science and Engineering, and will rely on in their future careers when developing systems and applications. Advanced operating systems enables students to specialise in operating systems, giving them the skills and insight to become highly competent developers or researchers in the general systems space, including operating systems, network systems, embedded and cyberphysical systems. The course produces graduates who are highly soughtafter by technology companies and systems researchers."
COMP9243,Distributed Systems,"A detailed coverage of distributed systems, with a particular focus on operating systems issues: clientserver paradigm, remoteprocedure call as OS support for clientserver; distributed shared memory, distributed memory coherency; distributed file systems; distributed process management, including load sharing and process migration; concurrency control; fault tolerance, recoverability and distributed transactions; naming; industry standards; case studies."
COMP9301,Cyber Security Project,Students will complete a small research project under the supervision of an academic member of the school and cosupervision of an industry expert as appropriate
COMP9302,Cyber Security Project B,Students will complete a large research project under the supervision of an academic member of the school and cosupervision of an industry expert as appropriate
COMP9312,Data Analytics for Graphs,"Graphs are ubiquitous and are widely used to capture relationships between different entities in realworld applications. However, compared with traditional sequential data e.G. Text and audio, the unstructured property and the sparsity make processing big graphs very challenging. The course will introduce a series of data structures and algorithms for graph processing in terms of database i.E., big data and deep learning. Fundamental methods and the stateoftheart research works will be integrated. The course will serve as a launching pad for those interested in graph analytics, big data processing and graph neural networks.Data structures and algorithms are the building blocks of many complex systems and software. Certain fundamental graph algorithms such as Dijkstras algorithm and depthfirst search have been covered by many text books and compulsory courses. They may be discussed in terms of pseudocode and time complexity. This course will start from studying how to efficiently implement the fundamental algorithms in big graphs. Then, the course explores more challenging and more complex algorithms stepbystep. When dealing with big graphs, we may consider various scenarios such as external memory solutions, distributed solutions, multicore solutions, etc.The course also puts some attention to graph neural networks, which is a hotspot in the area of AI and deep learning. The course will not study theoretical details about machine learning and deep learning but just introduce several representative graph neural networks. The students will play with basic graph learning tasks and understand learningbased techniques for graph problems such as link prediction and node classification."
COMP9313,Big Data Management,"This course introduces the core concepts and technologies involved in managing Big Data. It will first introduce the characteristics of big data and big data analysis. Then, we will learn the opensource big data management framework Hadoop. We will mainly focus on Hadoop MapReduce programming. YARN, HDFS, HBase, and Hive will be briefly introduced as well. We will also learn an opensource memorybased distributed computing framework Spark. Another major focus of this course is algorithm design on largescale data sets based on big data management frameworks, in various domains such as data stream mining, graph data processing, and finding similar items."
COMP9315,Database Systems Implementation,"This course aims to introduce students to the detailed internal structure of database management systems DBMSs such as Oracle or SQL Server. DBMSs contain a variety of interesting data structures and algorithms that are also potentially useful outside the DBMS context; knowing about them is a useful way of extending your general programming background. While the focus is on relational DBMSs, given that they have the bestdeveloped technological foundation, we will also consider more recent developments in the management of large data repositories.Relational DBMSs need to deal with a variety of issues: storage structures and management, implementation of relational operations, query optimisation, transactions, concurrency, recovery, security. The course will address most of these, along with a brief look at emerging database systems trends. The level of detail on individual topics will vary; some will be covered in significant detail, others will be covered relatively briefly.An important aspect of this course is to give you a chance to explore the internals of arealDBMS: PostgreSQL. Lectures will discuss the general principles of how DBMSs are implemented, and will also illustrate them with examples from PostgreSQL where possible. Since DBMSs are very large pieces of software, it wont be possible to explore the entire PostgreSQL system in depth."
