Course Code,Course Name,Course Summary
COMP9319,Web Data Compression and Search,"As the amount of Web data increases, it is becoming vital to not only be able to search and retrieve this information quickly, but also to store it in a compact manner. This is especially important for mobile devices which are becoming increasingly popular. Without loss of generality, within this course, we assume Web data excluding media content will be in XML and its like e.G., HTML, JSON.If time allows, we may cover optional topics such as: streaming algorithms, text analytics, Web data optimization for mobile devices. The lecture materials will be complemented by two programming assignments and numerous tutorialtype, written exercises."
COMP9321,Data Services Engineering,"This course aims to introduce the student to core concepts and practical skills for engineering the data in Webserviceoriented datadriven applications. Specifically, the course aims to expose students to basic infrastructure for building data services on the Web, including techniques to access and ingest data in internalexternal sources, develop software services to curate e.G. Extract, transform, correct, aggregate the data, develop services to apply various analytics and develop services to visualize the data to communicate effectively usingdata. The course uses the Python programming language as the practical basis for its modules. However, the concepts taught are universal and can be applied to any other web development languageframework."
COMP9332,Network Routing and Switching,"This course will focus on the routing and switching architectures, algorithms and protocols for packet switching networks, both connectionless and connection oriented networks such as IP and ATM networks. Advanced Internet addressing : CIDR, VPN, NAT. In depth discussion of interior and exterior routing protocols, such BGP, OSPF. IP over ATM solutions : such as LANE, Classical IP over ATM. IP switching and MPLS. Mobile IP. Internet Multicasting. Overview of emerging switching and routing technologies, such as optical routing and QoS routing. There is a substantial network programming component in the assessable material, for which C prgramming knowledge is assumed."
COMP9334,Capacity Planning of Computer Systems and Networks,"We live in a world that events do not happen instantly. It takes a certain amount of time to download a video from a server to your own mobile device. It takes a certain amount of time for a computer to finish the execution of an algorithm. The time to completion or response time in performance analysis terminology is a performance metric that computer scientists and computer engineers should be concerned about because no one wants to wait unnecessarily. If you can understand the factors that determine the response time, then you can influence those factors so that the response time becomes acceptable. This course will take a mathematical modelling and analytical approach to understand response time in computer systems and networks. The primary goal is to explore how mathematical modelling and mathematical methods can be used to model, analyse and design computer systems and networks so that they have good performance. There are three major topics that will be covered by this course:Queuing analysis Note: Queues are important because they give rise to waiting time., Discrete event simulation, Integer programming for network design"
COMP9417,Machine Learning and Data Mining,"Machine learning is the algorithmic approach to learning from data. The course also covers aspects of data mining, the application of machine learning to obtain insight from data. In this course machine learning algorithms are placed in the context of their theoretical foundations in order to understand their derivation and correct application. Machine learning also is an empirical science, where performance of algorithms must be rigorously evaluated on datasets. Completion of this course will contribute to further learning in advanced topics such as deep learning, bioinformatics, computer vision, and robotics. Topics covered in the course include: linear models for regression and classification, local methods nearest neighbour, tree learning, kernel machines, neural networks, unsupervised learning, ensemble learning, and learning theory. To expand and extend the development of theory and algorithms presented in lectures, practical examples will be given in tutorials and programming tasks during the project."
COMP9418,Advanced Topics in Statistical Machine Learning,"This course presents an indepth study of statistical machine learning approaches. It aims to provide the student with a solid understanding of methods for learning and inference in structured probabilistic models, with a healthy balance of theory and practice. It will cover topics on the semantics of direct and undirected representations in probabilistic graphical models, exact and approximate inference, and learning of model parameters and structure.In this course, we will study a class of statistical inference models known as Probabilistic Graphical Models PGMs. PGMs are a great example of how Computer Science and Statistics can work together. PGMs use graph data structures to represent domains with large amounts of variables and specialised algorithms for efficient inference over these graphical models. Therefore, PGMs have pushed the limits of probability theory to the scale and rate necessary to provide automated reasoning in modern AI systems.During this course, we will cover several graphical models, including Bayesian networks, Markov networks, Conditional Random Fields, Markov chains, Hidden Markov Models, Kalman Filters and Markov decision processes. We will have a clear understanding of how these models work as well as their main algorithms for inference and learning. We will also cover several algorithms used to learn parameters and make inferences such as Monte Carlo Markov Chains MCMC, Gibbs Sampling, Viterbi and the BaumWelch algorithms, among others."
COMP9444,Neural Networks and Deep Learning,"Neural networks and deep learning play a critical role in pushing the boundaries of what AI can achieve, making them indispensable for various industries and applications. Their ability to learn and adapt from data has revolutionised many fields and opened up new opportunities for solving complex problems. This course provides an introduction to and deep exploration of neural networks and deep learning principles and practice.Topics chosen from: perceptrons, feedforward neural networks, backpropagation, deep convolutional networks, image processing; geometric analysis of trained networks; recurrent networks, language processing, semantic analysis, long short term memory; deep reinforcement learning; autoencoders, generative models, adversarial training; designing successful applications of neural networks; recent developments in neural networks and deep learning."
COMP9447,Security Engineering Workshop,"Applied workshop in an emerging area in cyber security. The course is supervised and taught by relevant academics andor industry experts in the field. Areas vary depending on the availability of subject domain experts from time to time. Examples of relevant areas include: Cloud Security, Cryptanalysis on commercial products, mainframe security audit and penetration testing."
COMP9491,Applied Artificial Intelligence,"This course presents some advanced topics in various aspects of artificial intelligence such as computer vision, speech and language processing, deep learning, and knowledge representation and reasoning. The course aims to integrate these various aspects of AI and present case studies where such integration of different methodologies delivers interesting applications. Project development is the major component of this course, to develop a solution to a practical or industrybased problem that requires an integration of more than one type of AI techniques ranging from symbolic AI e.G. Knowledge representation and reasoning to deep learning, with example applications in computer vision, speech and language processing, etc. Assessment is based on group project development."
COMP9517,Computer Vision,"Computer vision is the interdisciplinary scientific field that develops theories and methods allowing computers to extract highlevel information from digital images or videos. From an engineering perspective it seeks to automate perceptual tasks normally performed by the human visual system. Generally, vision is difficult because it is an inverse problem, where only insufficient information is available about the objects of interest in the image data. Physicsbased mathematical and statistical models as well as machinelearning methods are used to assist in the task. Current realworld applications are wideranging, and include optical character recognition, machine inspection, retail object recognition, 3D model building, remote sensing, medical imaging, autonomous driving, motion capture, surveillance, face recognition, biometrics, and many others. This course provides an introduction to fundamental concepts and an opportunity to develop a realworld application of computer vision."
COMP9727,Recommender Systems,"Recommender systems are information filtering and search tools for providing personalized user interaction and navigation through a complex space of products or services. The aim is to address information overload by providing users with items that better meet their needs and support their decision making. Recommender systems are important commercial tools that are widely used by ecommerce and social media companies to drive sales and user engagement. This course will cover the basic types of recommender system, the main recommendation algorithms, and machine learning and natural language processing techniques used to support recommender systems."
